{
  "schema_version": "6.0",
  "site_name": "Northstar Plumbing Acceptance Company",
  "business_type": "contractor",
  "contractor_profile": {
    "trade_categories": ["plumbing"],
    "operating_model": "service-area",
    "address_publication": "service-area-only",
    "lead_actions": ["request-estimate"],
    "emergency_service": "not-confirmed",
    "proof_types": []
  },
  "public_domain": "https://plumber-v7-test.pages.dev",
  "package_version": "2026.08.29-test.1",
  "build_date": "2026-08-29T12:00:00Z",
  "stage": "production",
  "workflow_version": "6.0",
  "system_version": "contractor-system-pack-6.0",
  "business_assets_version": "contractor-business-assets-6.0",
  "repository_package_spec": "6.0",
  "design_lock_reference": "fixture-design-lock-2026-08-29",
  "final_approval_reference": "fixture-final-approval-2026-08-29",
  "primary_action": {
    "label": "Request test estimate",
    "url": "/contact.html"
  },
  "pages": [
    {
      "file_path": "index.html",
      "url_path": "/",
      "canonical_url_path": "/",
      "title": "Northstar Plumbing Acceptance Company | Plumbing Website QA",
      "purpose": "Fictitious acceptance-test contractor homepage.",
      "indexable": true
    },
    {
      "file_path": "services.html",
      "url_path": "/services.html",
      "canonical_url_path": "/services.html",
      "title": "Plumbing Services Fixture | Northstar Plumbing Acceptance Company",
      "purpose": "Readable plumbing service-page patterns and lead paths.",
      "indexable": true
    },
    {
      "file_path": "contact.html",
      "url_path": "/contact.html",
      "canonical_url_path": "/contact.html",
      "title": "Estimate Form Fixture | Northstar Plumbing Acceptance Company",
      "purpose": "Accessible request-estimate form with privacy and fallback contracts.",
      "indexable": true
    },
    {
      "file_path": "privacy.html",
      "url_path": "/privacy.html",
      "canonical_url_path": "/privacy.html",
      "title": "Privacy Fixture | Northstar Plumbing Acceptance Company",
      "purpose": "Acceptance-test privacy notice.",
      "indexable": true
    },
    {
      "file_path": "404.html",
      "url_path": "/404.html",
      "canonical_url_path": "/404.html",
      "title": "Page Not Found | Northstar Plumbing Acceptance Company",
      "purpose": "Helpful page-not-found response.",
      "indexable": false
    }
  ],
  "legacy_routes": [],
  "icons": [
    {"rel": "icon", "file_path": "assets/icons/favicon.ico", "mime_type": "image/x-icon", "sizes": ["16x16", "32x32", "48x48"]},
    {"rel": "icon", "file_path": "assets/icons/favicon.svg", "mime_type": "image/svg+xml", "sizes": ["any"]},
    {"rel": "apple-touch-icon", "file_path": "assets/icons/apple-touch-icon.png", "mime_type": "image/png", "sizes": ["180x180"]},
    {"rel": "manifest", "file_path": "site.webmanifest", "mime_type": "application/manifest+json", "sizes": []},
    {"rel": "app-icon", "file_path": "assets/icons/icon-192.png", "mime_type": "image/png", "sizes": ["192x192"]},
    {"rel": "app-icon", "file_path": "assets/icons/icon-512.png", "mime_type": "image/png", "sizes": ["512x512"]}
  ],
  "external_media": [],
  "public_documents": [],
  "forms": [
    {
      "id": "estimate-request",
      "enabled": true,
      "action": "/api/contact",
      "page": "contact.html",
      "purpose": "estimate request",
      "fallback": "/contact.html",
      "privacy_page": "privacy.html",
      "turnstile_action": "contact_submit"
    }
  ]
}
